{"id":"OBS-GEI-GEN1-001","type":"observation","title":"Initial execution state recorded","status":"active","version":"1.0.10","observation_status":"recorded","execution_ids":["EXE-GEI-GEN1-001"],"observation":"The V1.0.10 evaluation has been formally authorized and its execution protocol defined; substantive test observations have not yet been entered.","anomalies":[],"notes":"Administrative observation only. It is not evidence for or against the hydraulic hypothesis."}